{
  "$schema": "https://json-schema.org/draft/2020-12/schema",
  "$id": "https://github.com/jed-zed/trellis-ccg-harness/schemas/project-contract.schema.json",
  "title": "Trellis CCG Harness Project Contract",
  "type": "object",
  "required": [
    "schemaVersion",
    "status",
    "project",
    "authorities",
    "workflow",
    "toolchain",
    "qualityGates",
    "skills",
    "thirdParty",
    "security",
    "providers",
    "productManager",
    "hooks",
    "source",
    "ci",
    "unresolvedDecisions",
    "approval"
  ],
  "properties": {
    "schemaVersion": {
      "const": 1
    },
    "status": {
      "enum": [
        "draft",
        "approved",
        "ready"
      ]
    },
    "project": {
      "type": "object",
      "required": [
        "name",
        "purpose",
        "repositoryRoot",
        "adoptionMode"
      ]
    },
    "authorities": {
      "type": "object",
      "required": [
        "lifecycle",
        "tasks",
        "requirements",
        "specifications",
        "intelligence",
        "workspaceWriter"
      ],
      "properties": {
        "lifecycle": {
          "const": "trellis"
        },
        "tasks": {
          "const": ".trellis/tasks"
        },
        "requirements": {
          "const": ".trellis/tasks"
        },
        "specifications": {
          "const": ".trellis/spec"
        },
        "intelligence": {
          "const": "ccg"
        },
        "workspaceWriter": {
          "const": "codex"
        }
      }
    },
    "workflow": {
      "type": "object",
      "required": [
        "dispatchMode",
        "planningApprovalRequired",
        "taskLifecycle",
        "managedProjectPaths",
        "ignoredRuntimePaths",
        "forbiddenTrackedPaths"
      ],
      "properties": {
        "dispatchMode": {
          "const": "inline"
        },
        "planningApprovalRequired": {
          "const": true
        }
      }
    },
    "toolchain": {
      "type": "object"
    },
    "qualityGates": {
      "type": "object"
    },
    "skills": {
      "type": "object",
      "required": [
        "globalPolicy",
        "globalEssential",
        "repositoryProfile",
        "selectionMode",
        "installMode",
        "projectSelection"
      ],
      "properties": {
        "globalPolicy": {
          "const": "minimal-essential-only"
        },
        "globalEssential": {
          "type": "array",
          "items": {
            "type": "string",
            "pattern": "^[A-Za-z0-9]+(?:-[A-Za-z0-9]+)*$"
          },
          "minItems": 13,
          "maxItems": 13,
          "uniqueItems": true,
          "allOf": [
            {
              "contains": {
                "const": "harness-init"
              }
            },
            {
              "contains": {
                "const": "trellis-before-dev"
              }
            },
            {
              "contains": {
                "const": "trellis-brainstorm"
              }
            },
            {
              "contains": {
                "const": "trellis-break-loop"
              }
            },
            {
              "contains": {
                "const": "trellis-channel"
              }
            },
            {
              "contains": {
                "const": "trellis-check"
              }
            },
            {
              "contains": {
                "const": "trellis-continue"
              }
            },
            {
              "contains": {
                "const": "trellis-finish-work"
              }
            },
            {
              "contains": {
                "const": "trellis-meta"
              }
            },
            {
              "contains": {
                "const": "trellis-session-insight"
              }
            },
            {
              "contains": {
                "const": "trellis-spec-bootstrap"
              }
            },
            {
              "contains": {
                "const": "trellis-start"
              }
            },
            {
              "contains": {
                "const": "trellis-update-spec"
              }
            }
          ]
        },
        "repositoryProfile": {
          "const": "user-saved"
        },
        "selectionMode": {
          "const": "recommend-and-approve"
        },
        "installMode": {
          "const": "copy"
        },
        "projectSelection": {
          "type": "array",
          "items": {
            "type": "object",
            "required": [
              "name",
              "reason"
            ],
            "properties": {
              "name": {
                "type": "string",
                "pattern": "^[A-Za-z0-9]+(?:-[A-Za-z0-9]+)*$"
              },
              "reason": {
                "type": "string",
                "minLength": 1
              }
            },
            "additionalProperties": false
          }
        }
      },
      "additionalProperties": false
    },
    "thirdParty": {
      "type": "object",
      "required": [
        "sourceManifestSha256",
        "globalSkills",
        "globalPlugins",
        "projectSkills",
        "mcpCli",
        "excluded"
      ],
      "properties": {
        "sourceManifestSha256": {
          "type": [
            "string",
            "null"
          ],
          "pattern": "^[a-f0-9]{64}$"
        },
        "globalSkills": {
          "type": "array",
          "items": {
            "type": "string"
          },
          "uniqueItems": true
        },
        "globalPlugins": {
          "type": "array",
          "items": {
            "type": "string"
          },
          "uniqueItems": true
        },
        "projectSkills": {
          "type": "array",
          "items": {
            "type": "string"
          },
          "uniqueItems": true
        },
        "mcpCli": {
          "type": "array",
          "items": {
            "type": "string"
          },
          "uniqueItems": true
        },
        "excluded": {
          "type": "array",
          "items": {
            "type": "string"
          },
          "uniqueItems": true
        }
      },
      "additionalProperties": false
    },
    "security": {
      "type": "object",
      "required": [
        "dataClassification",
        "secretPolicy",
        "networkPolicy",
        "strictDataBoundary",
        "credentialFieldsForbidden",
        "forbiddenTrackedPaths"
      ],
      "properties": {
        "secretPolicy": {
          "const": "environment-or-owned-secret-store"
        },
        "strictDataBoundary": {
          "type": [
            "boolean",
            "null"
          ]
        },
        "credentialFieldsForbidden": {
          "const": true
        }
      }
    },
    "providers": {
      "type": "object"
    },
    "productManager": {
      "type": "object",
      "required": [
        "stateAuthority",
        "stateFile",
        "evidenceRoot",
        "selectedProviderAuthority",
        "allowedProviders",
        "providerCapabilities"
      ],
      "properties": {
        "stateAuthority": {
          "const": "trellis-task-projection"
        },
        "stateFile": {
          "const": ".trellis/tasks/<task>/product-manager.json"
        },
        "evidenceRoot": {
          "const": ".trellis/tasks/<task>/.ccg-evidence/product-manager"
        },
        "selectedProviderAuthority": {
          "const": "unified-ccg-routing"
        },
        "allowedProviders": {
          "type": "array",
          "items": {
            "enum": [
              "codex",
              "gemini",
              "claude"
            ]
          },
          "uniqueItems": true
        },
        "providerCapabilities": {
          "type": "object",
          "required": [
            "codex",
            "gemini",
            "claude"
          ],
          "properties": {
            "codex": {
              "$ref": "#/$defs/readOnlyProductManagerProvider"
            },
            "gemini": {
              "$ref": "#/$defs/readOnlyProductManagerProvider"
            },
            "claude": {
              "$ref": "#/$defs/readOnlyProductManagerProvider"
            }
          },
          "additionalProperties": false
        }
      },
      "additionalProperties": false
    },
    "hooks": {
      "type": "object",
      "properties": {
        "globalMutationAllowed": {
          "const": false
        }
      }
    },
    "source": {
      "type": "object"
    },
    "ci": {
      "type": "object",
      "properties": {
        "offlineByDefault": {
          "const": true
        }
      }
    },
    "unresolvedDecisions": {
      "type": "array"
    },
    "approval": {
      "type": "object",
      "required": [
        "approvedAt",
        "approvedBy"
      ]
    }
  },
  "additionalProperties": false,
  "$defs": {
    "readOnlyProductManagerProvider": {
      "type": "object",
      "required": [
        "readOnly",
        "workspaceWrite",
        "terminal",
        "subagents",
        "network",
        "paid"
      ],
      "properties": {
        "readOnly": {
          "const": true
        },
        "workspaceWrite": {
          "const": false
        },
        "terminal": {
          "const": false
        },
        "subagents": {
          "const": false
        },
        "network": {
          "const": "explicit-per-call"
        },
        "paid": {
          "const": "explicit-per-call"
        }
      },
      "additionalProperties": false
    }
  }
}
