{
  "schemaVersion": 1,
  "status": "approved",
  "project": {
    "name": "harness-public-clean-install",
    "purpose": "Verify the public Harness baseline in an isolated project without a personal Skill catalog.",
    "repositoryRoot": ".",
    "adoptionMode": "clean-install-acceptance"
  },
  "authorities": {
    "lifecycle": "trellis",
    "tasks": ".trellis/tasks",
    "requirements": ".trellis/tasks",
    "specifications": ".trellis/spec",
    "intelligence": "ccg",
    "workspaceWriter": "codex"
  },
  "workflow": {
    "dispatchMode": "inline",
    "planningApprovalRequired": true,
    "taskLifecycle": [
      "planned",
      "implemented",
      "verified"
    ],
    "managedProjectPaths": [
      ".harness/third-party-sources.json"
    ],
    "ignoredRuntimePaths": [
      ".ccg",
      ".codex/ccg"
    ],
    "forbiddenTrackedPaths": [
      ".ccg",
      ".codex/ccg",
      ".claude"
    ]
  },
  "toolchain": {
    "languages": [],
    "runtimes": [
      "Node.js >=20"
    ],
    "packageManagers": [],
    "platforms": [
      "Windows",
      "Ubuntu",
      "macOS"
    ],
    "commands": {
      "install": [],
      "build": [],
      "lint": [],
      "format": [],
      "typecheck": [],
      "test": [],
      "package": []
    }
  },
  "qualityGates": {
    "requiredLocalCommands": [],
    "requiredCiChecks": [],
    "definitionOfDone": [
      "Harness doctor and conflict audit pass",
      "The project contract is marked ready only after the public acceptance gates pass",
      "No user or project .claude tree is created or modified"
    ]
  },
  "skills": {
    "globalPolicy": "minimal-essential-only",
    "globalEssential": [
      "harness-init",
      "trellis-before-dev",
      "trellis-brainstorm",
      "trellis-break-loop",
      "trellis-channel",
      "trellis-check",
      "trellis-continue",
      "trellis-finish-work",
      "trellis-meta",
      "trellis-session-insight",
      "trellis-spec-bootstrap",
      "trellis-start",
      "trellis-update-spec"
    ],
    "repositoryProfile": "user-saved",
    "selectionMode": "recommend-and-approve",
    "installMode": "copy",
    "projectSelection": []
  },
  "thirdParty": {
    "sourceManifestSha256": "8176e5526fbb4d953047ecf110a503983c98dae6db71dfd31fed8b5064225903",
    "globalSkills": [],
    "globalPlugins": [],
    "projectSkills": [],
    "mcpCli": [],
    "excluded": []
  },
  "security": {
    "dataClassification": "public-source-code-no-credentials",
    "secretPolicy": "environment-or-owned-secret-store",
    "networkPolicy": "offline-by-default-explicit-public-fetch-only",
    "strictDataBoundary": false,
    "credentialFieldsForbidden": true,
    "forbiddenTrackedPaths": [
      ".env",
      ".ccg",
      ".codex/ccg",
      ".claude",
      "credentials.json"
    ]
  },
  "providers": {
    "codex": {
      "enabled": true,
      "workspaceWrite": true
    },
    "gemini": {
      "enabled": false,
      "workspaceWrite": false
    },
    "claude": {
      "enabled": false,
      "workspaceWrite": false
    },
    "grok": {
      "enabled": false,
      "manualOnly": true,
      "workspaceWrite": false
    },
    "gptPro": {
      "enabled": false,
      "manualOnly": false,
      "workspaceWrite": false
    }
  },
  "productManager": {
    "stateAuthority": "trellis-task-projection",
    "stateFile": ".trellis/tasks/<task>/product-manager.json",
    "evidenceRoot": ".trellis/tasks/<task>/.ccg-evidence/product-manager",
    "selectedProviderAuthority": "unified-ccg-routing",
    "allowedProviders": [
      "codex",
      "gemini",
      "claude"
    ],
    "providerCapabilities": {
      "codex": {
        "readOnly": true,
        "workspaceWrite": false,
        "terminal": false,
        "subagents": false,
        "network": "explicit-per-call",
        "paid": "explicit-per-call"
      },
      "gemini": {
        "readOnly": true,
        "workspaceWrite": false,
        "terminal": false,
        "subagents": false,
        "network": "explicit-per-call",
        "paid": "explicit-per-call"
      },
      "claude": {
        "readOnly": true,
        "workspaceWrite": false,
        "terminal": false,
        "subagents": false,
        "network": "explicit-per-call",
        "paid": "explicit-per-call"
      }
    }
  },
  "hooks": {
    "projectAuthorities": [
      ".codex/hooks.json"
    ],
    "globalMutationAllowed": false,
    "ownershipManifest": ".harness/ownership.json"
  },
  "source": {
    "repositories": [
      "https://github.com/jed-zed/trellis-ccg-harness",
      "https://github.com/jed-zed/ccg-gptpro-worflow",
      "https://github.com/mindfold-ai/trellis"
    ],
    "dependencyPolicy": "locked-and-source-verified",
    "updatePolicy": "explicit-version-or-commit",
    "rollbackPolicy": "transactional-and-ownership-aware",
    "uninstallPolicy": "remove-only-owned-unchanged-state"
  },
  "ci": {
    "platforms": [],
    "runtimeMatrix": [],
    "offlineByDefault": true
  },
  "unresolvedDecisions": [],
  "approval": {
    "approvedAt": "2026-07-26T00:00:00.000Z",
    "approvedBy": "trellis-ccg-harness-maintainers"
  }
}
