{
  "schemaVersion": 1,
  "status": "draft",
  "project": {
    "name": null,
    "purpose": null,
    "repositoryRoot": ".",
    "adoptionMode": null
  },
  "authorities": {
    "lifecycle": "trellis",
    "tasks": ".trellis/tasks",
    "requirements": ".trellis/tasks",
    "specifications": ".trellis/spec",
    "intelligence": "ccg",
    "workspaceWriter": "codex"
  },
  "workflow": {
    "dispatchMode": "inline",
    "planningApprovalRequired": true,
    "taskLifecycle": [],
    "managedProjectPaths": [],
    "ignoredRuntimePaths": [],
    "forbiddenTrackedPaths": []
  },
  "toolchain": {
    "languages": [],
    "runtimes": [],
    "packageManagers": [],
    "platforms": [],
    "commands": {
      "install": [],
      "build": [],
      "lint": [],
      "format": [],
      "typecheck": [],
      "test": [],
      "package": []
    }
  },
  "qualityGates": {
    "requiredLocalCommands": [],
    "requiredCiChecks": [],
    "definitionOfDone": []
  },
  "skills": {
    "globalPolicy": "minimal-essential-only",
    "globalEssential": [
      "chatgpt-pro-sidebar",
      "grill-with-docs",
      "harness-init",
      "trellis-before-dev",
      "trellis-brainstorm",
      "trellis-break-loop",
      "trellis-channel",
      "trellis-check",
      "trellis-continue",
      "trellis-finish-work",
      "trellis-meta",
      "trellis-session-insight",
      "trellis-spec-bootstrap",
      "trellis-start",
      "trellis-update-spec"
    ],
    "repositoryProfile": "user-saved",
    "selectionMode": "recommend-and-approve",
    "installMode": "copy",
    "projectSelection": []
  },
  "thirdParty": {
    "sourceManifestSha256": null,
    "globalSkills": [],
    "globalPlugins": [],
    "projectSkills": [],
    "mcpCli": [],
    "excluded": []
  },
  "security": {
    "dataClassification": null,
    "secretPolicy": "environment-or-owned-secret-store",
    "networkPolicy": null,
    "strictDataBoundary": null,
    "credentialFieldsForbidden": true,
    "forbiddenTrackedPaths": []
  },
  "providers": {
    "codex": {
      "enabled": true,
      "workspaceWrite": true
    },
    "gemini": {
      "enabled": false,
      "workspaceWrite": false
    },
    "claude": {
      "enabled": false,
      "workspaceWrite": false
    },
    "grok": {
      "enabled": false,
      "manualOnly": true,
      "workspaceWrite": false
    },
    "gptPro": {
      "enabled": false,
      "manualOnly": false,
      "workspaceWrite": false
    }
  },
  "productManager": {
    "stateAuthority": "trellis-task-projection",
    "stateFile": ".trellis/tasks/<task>/product-manager.json",
    "evidenceRoot": ".trellis/tasks/<task>/.ccg-evidence/product-manager",
    "selectedProviderAuthority": "unified-ccg-routing",
    "allowedProviders": [
      "codex",
      "gemini",
      "claude"
    ],
    "providerCapabilities": {
      "codex": {
        "readOnly": true,
        "workspaceWrite": false,
        "terminal": false,
        "subagents": false,
        "network": "explicit-per-call",
        "paid": "explicit-per-call"
      },
      "gemini": {
        "readOnly": true,
        "workspaceWrite": false,
        "terminal": false,
        "subagents": false,
        "network": "explicit-per-call",
        "paid": "explicit-per-call"
      },
      "claude": {
        "readOnly": true,
        "workspaceWrite": false,
        "terminal": false,
        "subagents": false,
        "network": "explicit-per-call",
        "paid": "explicit-per-call"
      }
    }
  },
  "hooks": {
    "projectAuthorities": [],
    "globalMutationAllowed": false,
    "ownershipManifest": null
  },
  "source": {
    "repositories": [],
    "dependencyPolicy": null,
    "updatePolicy": null,
    "rollbackPolicy": null,
    "uninstallPolicy": null
  },
  "ci": {
    "platforms": [],
    "runtimeMatrix": [],
    "offlineByDefault": true
  },
  "unresolvedDecisions": [],
  "approval": {
    "approvedAt": null,
    "approvedBy": null
  }
}
